[
  {
    "id": "republic-gyges",
    "title": "Ring of Gyges",
    "dialogue": "Republic",
    "book": "II",
    "stephanus": {"start": "359a", "end": "360d"},
    "speaker": "Glaucon",
    "audience": "Socrates and the dialogue's interlocutors",
    "narrative_status": "thought-experiment-with-traditional-material",
    "argument_context": "Glaucon challenges Socrates to show why justice is valued beyond reputation and external reward.",
    "primary_source_id": "perseus-republic-cave",
    "analysis_prompts": ["What does invisibility remove from the social situation?", "What does the challenge ask Socrates to prove about justice?"],
    "non_claims": ["not a behavioral experiment", "not evidence that every person is inherently unjust"]
  },
  {
    "id": "republic-noble-lie",
    "title": "Civic foundation story and metals",
    "dialogue": "Republic",
    "book": "III",
    "stephanus": {"start": "414b", "end": "415d"},
    "speaker": "Socrates",
    "audience": "Glaucon and the dialogue's interlocutors",
    "narrative_status": "civic-foundation-story",
    "argument_context": "The story appears in a discussion of guardians and civic formation in the proposed city.",
    "primary_source_id": "perseus-republic-cave",
    "analysis_prompts": ["Which political work is the story asked to perform?", "How does the surrounding discussion constrain a reading of the story?"],
    "non_claims": ["not a factual anthropology", "not a justification for ranking living people by supposed natural metals"]
  },
  {
    "id": "republic-cave",
    "title": "Cave",
    "dialogue": "Republic",
    "book": "VII",
    "stephanus": {"start": "514a", "end": "521b"},
    "speaker": "Socrates",
    "audience": "Glaucon",
    "narrative_status": "image",
    "argument_context": "The image develops a discussion of education, knowledge, turning the soul, and the philosopher's return to the city.",
    "primary_source_id": "perseus-republic-cave",
    "analysis_prompts": ["How does the image stage change in what is taken as real?", "Why does the return to the cave matter politically?"],
    "non_claims": ["not historical evidence", "not simulation proof", "not a neurological model"]
  },
  {
    "id": "republic-er",
    "title": "Myth of Er",
    "dialogue": "Republic",
    "book": "X",
    "stephanus": {"start": "614b", "end": "621d"},
    "speaker": "Socrates",
    "audience": "Glaucon",
    "narrative_status": "eschatological-narrative",
    "argument_context": "The narrative closes the dialogue's long inquiry into justice, choice, and the formation of a life.",
    "primary_source_id": "perseus-republic-cave",
    "analysis_prompts": ["How are choice and responsibility staged in the narrative?", "How does the closing narrative relate to the prior argument about justice?"],
    "non_claims": ["not empirical afterlife evidence", "not a deterministic horoscope of a future life"]
  },
  {
    "id": "symposium-aristophanes",
    "title": "Aristophanes' divided humans",
    "dialogue": "Symposium",
    "book": "",
    "stephanus": {"start": "189c", "end": "193d"},
    "speaker": "Aristophanes",
    "audience": "The symposium participants",
    "narrative_status": "comic-speech",
    "argument_context": "Aristophanes gives one speech among several speeches about eros; it precedes Socrates' report of Diotima.",
    "primary_source_id": "perseus-symposium-189",
    "analysis_prompts": ["What does the comic story explain about longing and wholeness?", "How does its speaker and genre differ from Diotima's account?"],
    "non_claims": ["not Diotima's doctrine", "not Plato's unqualified final view", "not a biological account of sex or gender"]
  },
  {
    "id": "symposium-diotima",
    "title": "Diotima's account of eros",
    "dialogue": "Symposium",
    "book": "",
    "stephanus": {"start": "201d", "end": "212c"},
    "speaker": "Socrates reporting Diotima",
    "audience": "The symposium participants",
    "narrative_status": "reported-teaching",
    "argument_context": "Socrates recounts a teaching attributed to Diotima during the dialogue's sequence of speeches on eros.",
    "primary_source_id": "perseus-symposium-189",
    "analysis_prompts": ["How does the reported teaching relate desire to beauty and generation?", "What changes when the account is treated as reported speech?"],
    "non_claims": ["not a self-help ladder", "not interchangeable with Aristophanes' comic speech"]
  },
  {
    "id": "phaedrus-chariot",
    "title": "Winged chariot and soul",
    "dialogue": "Phaedrus",
    "book": "",
    "stephanus": {"start": "246a", "end": "257b"},
    "speaker": "Socrates",
    "audience": "Phaedrus",
    "narrative_status": "image",
    "argument_context": "The image belongs to a speech about soul, desire, divine procession, recollection, and love.",
    "primary_source_id": "perseus-phaedrus-246",
    "analysis_prompts": ["What does the image make visible about divided desire and guidance?", "Which claims are image-language rather than modern psychology?"],
    "non_claims": ["not neuroscience", "not a literal diagram of the brain"]
  },
  {
    "id": "phaedrus-theuth",
    "title": "Theuth and writing",
    "dialogue": "Phaedrus",
    "book": "",
    "stephanus": {"start": "274c", "end": "275b"},
    "speaker": "Socrates",
    "audience": "Phaedrus",
    "narrative_status": "reported-traditional-story",
    "argument_context": "The story appears in a discussion of writing, memory, speech, and dialectic.",
    "primary_source_id": "perseus-phaedrus-246",
    "analysis_prompts": ["What distinction between memory and external reminders is being explored?", "Why should the story be read with the surrounding discussion of dialectic?"],
    "non_claims": ["not a simple ban on writing", "not a prediction about every later technology"]
  },
  {
    "id": "phaedo-afterlife",
    "title": "Afterlife geography",
    "dialogue": "Phaedo",
    "book": "",
    "stephanus": {"start": "107c", "end": "115a"},
    "speaker": "Socrates",
    "audience": "Simmias, Cebes, and companions",
    "narrative_status": "eschatological-narrative",
    "argument_context": "The narrative comes near the end of the dialogue's treatment of the soul and philosophical preparation for death.",
    "primary_source_id": "perseus-plato-collection",
    "analysis_prompts": ["How does the narrative connect moral formation with the dialogue's treatment of soul?", "What is lost if its geography is read as a travel guide?"],
    "non_claims": ["not empirical geography", "not empirical afterlife evidence"]
  },
  {
    "id": "gorgias-judgment",
    "title": "Post-mortem judgment",
    "dialogue": "Gorgias",
    "book": "",
    "stephanus": {"start": "523a", "end": "527a"},
    "speaker": "Socrates",
    "audience": "Callicles",
    "narrative_status": "eschatological-narrative",
    "argument_context": "Socrates uses the narrative while arguing about justice, punishment, and rhetoric with Callicles.",
    "primary_source_id": "perseus-plato-collection",
    "analysis_prompts": ["How does judgment without social trappings illuminate the dialogue's concern with justice?", "How does the story differ from evidence in a legal case?"],
    "non_claims": ["not courtroom evidence of an afterlife", "not a description verified by observation"]
  },
  {
    "id": "statesman-kronos",
    "title": "Age of Kronos and cosmic reversal",
    "dialogue": "Statesman",
    "book": "",
    "stephanus": {"start": "268d", "end": "274e"},
    "speaker": "Eleatic Stranger",
    "audience": "Young Socrates",
    "narrative_status": "cosmic-narrative",
    "argument_context": "The Stranger develops a cosmological story while distinguishing kinds of rule and political expertise.",
    "primary_source_id": "perseus-plato-collection",
    "analysis_prompts": ["What contrast between divine and human care does the reversal frame?", "Why is a cosmic sequence not automatically a historical chronology?"],
    "non_claims": ["not historical chronology", "not modern astronomy"]
  },
  {
    "id": "timaeus-atlantis",
    "title": "Atlantis frame",
    "dialogue": "Timaeus",
    "book": "",
    "stephanus": {"start": "20d", "end": "26e"},
    "speaker": "Critias",
    "audience": "Socrates, Timaeus, and Hermocrates",
    "narrative_status": "contested-political-narrative",
    "argument_context": "Critias presents a story about ancient Athens and Atlantis as the dialogue turns toward an account of an ideal city and its action; the story continues in the unfinished Critias.",
    "primary_source_id": "scaife-timaeus-21",
    "analysis_prompts": ["How does the frame relate political memory to the ideal city discussion?", "What is the difference between a narrative's setting and archaeological evidence?"],
    "non_claims": ["not archaeological proof", "not a real-world map", "not evidence for a lost continent"]
  },
  {
    "id": "timaeus-cosmology",
    "title": "Cosmological account",
    "dialogue": "Timaeus",
    "book": "",
    "stephanus": {"start": "27d", "end": "92c"},
    "speaker": "Timaeus",
    "audience": "Socrates, Critias, and Hermocrates",
    "narrative_status": "cosmological-account",
    "argument_context": "Timaeus gives an account of cosmic order that is framed by the dialogue's distinctions between being, becoming, and likely account.",
    "primary_source_id": "scaife-timaeus-21",
    "analysis_prompts": ["Which assumptions about order and explanation structure the account?", "Why should its cosmology be read in its ancient philosophical context rather than as current science?"],
    "non_claims": ["not modern empirical cosmology", "not a substitute for astronomy or physics"]
  }
]
